{
  "runtime_events_version": "godot-codex-bridge/runtime-events-v1",
  "generated_at": "2026-06-24T13:00:03Z",
  "source": "res://addons/godot_codex_bridge/runtime_state_probe.gd",
  "event_count": 4,
  "max_events": 200,
  "truncated": false,
  "events": [
    {
      "id": "2026-06-24T13:00:00Z:probe_ready",
      "at": "2026-06-24T13:00:00Z",
      "type": "probe_ready",
      "payload": {
        "node_path": "/root/GodotCodexRuntimeProbe"
      }
    },
    {
      "id": "2026-06-24T13:00:01Z:scene_changed",
      "at": "2026-06-24T13:00:01Z",
      "type": "scene_changed",
      "payload": {
        "previous_scene": "",
        "current_scene": "/root/Main",
        "active_scene": {
          "name": "Main",
          "type": "Node3D",
          "path": "/root/Main"
        }
      }
    },
    {
      "id": "2026-06-24T13:00:02Z:node_added",
      "at": "2026-06-24T13:00:02Z",
      "type": "node_added",
      "payload": {
        "path": "/root/Main/Enemy",
        "name": "Enemy",
        "type": "CharacterBody3D",
        "scene_file_path": "res://actors/enemy.tscn",
        "dimension": "3d",
        "global_position": {
          "x": 4.0,
          "y": 0.0,
          "z": -2.0
        }
      }
    },
    {
      "id": "2026-06-24T13:00:03Z:input_action_pressed",
      "at": "2026-06-24T13:00:03Z",
      "type": "input_action_pressed",
      "payload": {
        "name": "jump",
        "strength": 1.0
      }
    }
  ],
  "observability": {
    "level": "opt_in_runtime_probe",
    "arbitrary_script_execution": false,
    "scene_mutation": false,
    "scene_save": false,
    "input_injection": false
  },
  "privacy": {
    "classification": "local_sensitive_runtime_evidence",
    "external_upload_allowed": false
  }
}
